{
  "phase": "phase-3-documentation",
  "sprint": "sprint-2",
  "description": "Documentation setup and commercial assets",
  "streams": [],
  "aggregated_metrics": {
    "total_tasks": 4,
    "done": 4,
    "in_progress": 0,
    "blocked": 0,
    "not_started": 0
  },
  "started_at": "2025-12-22T21:00:00Z",
  "completed_at": "2025-12-22T21:30:00Z",
  "target_duration_minutes": 60,
  "actual_duration_minutes": 30
}
